{
  "generated_at": "2026-02-09T12:19:01.120201",
  "total_failed": 3,
  "failed_databases": [
    {
      "database": {
        "name": "DS_DEMO_DATA",
        "database_id": "XXXXXXXX-XXXX-XXXX-XXXX-XXXXXXXXXXXX",
        "connection_id": "XXXXXXXX-XXXX-XXXX-XXXX-XXXXXXXXXXXX"
      },
      "error": "Database API request failed: 500 Server Error: Internal Server Error for url: https://XXX.collibra.com/rest/catalogDatabase/v1/databases/XXXXXXXX-XXXX-XXXX-XXXX-XXXXXXXXXXXX/synchronizeMetadata",
      "owners": [
        {
          "owner_id": "XXXXXXXX-XXXX-XXXX-XXXX-XXXXXXXXXXXX",
          "email": "XXX@example.com",
          "username": null,
          "name": "XXX XXX"
        },
        {
          "owner_id": "XXXXXXXX-XXXX-XXXX-XXXX-XXXXXXXXXXXX",
          "email": "XXX@example.com",
          "username": null,
          "name": "XXX XXX"
        }
      ],
      "notification_message": "Hello,\n\nWe wanted to inform you that the metadata synchronization for your database has failed.\n\nDatabase: DS_DEMO_DATA\nDatabase ID: XXXXXXXXXXXX-XXXX-XXXX-XXXX-XXXXXXXXXXXX\nConnection ID: XXXXXXXXXXXX-XXXX-XXXX-XXXX-XXXXXXXXXXXX\n\nError Details:\n  Database API request failed: 500 Server Error: Internal Server Error for url: https://XXX.collibra.com/rest/catalogDatabase/v1/databases/XXXXXXXX-XXXX-XXXX-XXXX-XXXXXXXXXXXX/synchronizeMetadata\n\nThis notification is being sent to all 2 owners of this database:\n\n  1. XXX XXX (XXX@example.com)\n  2. XXX XXX (XXX@example.com)\n\nPlease review the database connection settings and credentials to resolve this issue.\n\nIf you need assistance, please contact your Collibra administrator.\n\nBest regards,\nCollibra Database Synchronization System"
    },
    {
      "database": {
        "name": "SNOWFLAKE",
        "database_id": "XXXXXXXX-XXXX-XXXX-XXXX-XXXXXXXXXXXX",
        "connection_id": "XXXXXXXX-XXXX-XXXX-XXXX-XXXXXXXXXXXX"
      },
      "error": "Database API request failed: 400 Client Error: Bad Request for url: https://XXX.collibra.com/rest/catalogDatabase/v1/databases/XXXXXXXX-XXXX-XXXX-XXXX-XXXXXXXXXXXX/synchronizeMetadata",
      "owners": [
        {
          "owner_id": "XXXXXXXX-XXXX-XXXX-XXXX-XXXXXXXXXXXX",
          "email": "XXX@example.com",
          "username": null,
          "name": "XXX XXX"
        },
        {
          "owner_id": "XXXXXXXX-XXXX-XXXX-XXXX-XXXXXXXXXXXX",
          "email": "XXX@example.com",
          "username": null,
          "name": "XXX XXX"
        }
      ],
      "notification_message": "Hello,\n\nWe wanted to inform you that the metadata synchronization for your database has failed.\n\nDatabase: SNOWFLAKE\nDatabase ID: XXXXXXXXXXXX-XXXX-XXXX-XXXX-XXXXXXXXXXXX\nConnection ID: XXXXXXXXXXXX-XXXX-XXXX-XXXX-XXXXXXXXXXXX\n\nError Details:\n  Database API request failed: 400 Client Error: Bad Request for url: https://XXX.collibra.com/rest/catalogDatabase/v1/databases/XXXXXXXX-XXXX-XXXX-XXXX-XXXXXXXXXXXX/synchronizeMetadata\n\nThis notification is being sent to all 2 owners of this database:\n\n  1. XXX XXX (XXX@example.com)\n  2. XXX XXX (XXX@example.com)\n\nPlease review the database connection settings and credentials to resolve this issue.\n\nIf you need assistance, please contact your Collibra administrator.\n\nBest regards,\nCollibra Database Synchronization System"
    },
    {
      "database": {
        "name": "SNOWFLAKE_LEARNING_DB",
        "database_id": "XXXXXXXX-XXXX-XXXX-XXXX-XXXXXXXXXXXX",
        "connection_id": "XXXXXXXX-XXXX-XXXX-XXXX-XXXXXXXXXXXX"
      },
      "error": "Database API request failed: 400 Client Error: Bad Request for url: https://XXX.collibra.com/rest/catalogDatabase/v1/databases/XXXXXXXX-XXXX-XXXX-XXXX-XXXXXXXXXXXX/synchronizeMetadata",
      "owners": [
        {
          "owner_id": "XXXXXXXX-XXXX-XXXX-XXXX-XXXXXXXXXXXX",
          "email": "XXX@example.com",
          "username": null,
          "name": "XXX XXX"
        }
      ],
      "notification_message": "Hello,\n\nWe wanted to inform you that the metadata synchronization for your database has failed.\n\nDatabase: SNOWFLAKE_LEARNING_DB\nDatabase ID: XXXXXXXXXXXX-XXXX-XXXX-XXXX-XXXXXXXXXXXX\nConnection ID: XXXXXXXXXXXX-XXXX-XXXX-XXXX-XXXXXXXXXXXX\n\nError Details:\n  Database API request failed: 400 Client Error: Bad Request for url: https://XXX.collibra.com/rest/catalogDatabase/v1/databases/XXXXXXXX-XXXX-XXXX-XXXX-XXXXXXXXXXXX/synchronizeMetadata\n\nThis notification is being sent to you as the owner of this database.\nOwner: XXX XXX\n\nPlease review the database connection settings and credentials to resolve this issue.\n\nIf you need assistance, please contact your Collibra administrator.\n\nBest regards,\nCollibra Database Synchronization System"
    }
  ]
}